<?xml version="1.1" encoding="UTF-8"?>
<graph:graph xmlns:graph="http://www.uni-miskolc.hu/ilona/graphShema"
	xmlns:xsi="http://www.w3.org/2001/XMLSchema-instance"
	xsi:schemaLocation="http://www.uni-miskolc.hu/ilona/graphShema graphShema.xsd ">
	<graph:nodes>
		<graph:node>
			<graph:name>ROOM100_INNER1</graph:name>
			<graph:description>Room 100 inner</graph:description>
		</graph:node>
		<graph:node>
			<graph:name>ROOM100_DOOR</graph:name>
			<graph:description>Room 100 door</graph:description>
		</graph:node>

		<graph:node>
			<graph:name>ROOM101_INNER1</graph:name>
			<graph:description>Room 101 inner</graph:description>
		</graph:node>
		<graph:node>
			<graph:name>ROOM101_DOOR</graph:name>
			<graph:description>Room 100 door</graph:description>
		</graph:node>

		<graph:node>
			<graph:name>ROOM102_INNER1</graph:name>
			<graph:description>Room 102 inner</graph:description>
		</graph:node>
		<graph:node>
			<graph:name>ROOM102_DOOR</graph:name>
			<graph:description>Room 102 door</graph:description>
		</graph:node>

		<graph:node>
			<graph:name>ROOMTOP4_INNER1</graph:name>
			<graph:description>Room top 4 inner</graph:description>
		</graph:node>
		<graph:node>
			<graph:name>ROOMTOP4_DOOR</graph:name>
			<graph:description>Room top 4 door</graph:description>
		</graph:node>

		<graph:node>
			<graph:name>ROOM103_INNER1</graph:name>
			<graph:description>Room 103 inner</graph:description>
		</graph:node>
		<graph:node>
			<graph:name>ROOM103_DOOR</graph:name>
			<graph:description>Room 103 door</graph:description>
		</graph:node>

		<graph:node>
			<graph:name>ROOM104_INNER1</graph:name>
			<graph:description>Room 104 inner</graph:description>
		</graph:node>
		<graph:node>
			<graph:name>ROOM104_DOOR</graph:name>
			<graph:description>Room 104 door</graph:description>
		</graph:node>

		<graph:node>
			<graph:name>TOPCORRIDOR_NODE1</graph:name>
			<graph:description>TOPCORRIDOR_NODE1</graph:description>
		</graph:node>
		<graph:node>
			<graph:name>TOPCORRIDOR_NODE2</graph:name>
			<graph:description>Room 104 door</graph:description>
		</graph:node>
		<graph:node>
			<graph:name>TOPCORRIDOR_NODE3</graph:name>
			<graph:description>Room 104 door</graph:description>
		</graph:node>
		<graph:node>
			<graph:name>TOPCORRIDOR_NODE4</graph:name>
			<graph:description>Room 104 door</graph:description>
		</graph:node>
		<graph:node>
			<graph:name>TOPCORRIDOR_NODE5</graph:name>
			<graph:description>Room 104 door</graph:description>
		</graph:node>
		<graph:node>
			<graph:name>TOPCORRIDOR_NODE6</graph:name>
			<graph:description>Room 104 door</graph:description>
		</graph:node>
		<graph:node>
			<graph:name>TOPCORRIDOR_NODE7</graph:name>
			<graph:description>Room 104 door</graph:description>
		</graph:node>
		<graph:node>
			<graph:name>TOPCORRIDOR_NODE8</graph:name>
			<graph:description>Room 104 door</graph:description>
		</graph:node>

		<graph:node>
			<graph:name>LEFTCORRIDOR_NODE1</graph:name>
			<graph:description>Room 104 door</graph:description>
		</graph:node>
		<graph:node>
			<graph:name>LEFTCORRIDOR_NODE2</graph:name>
			<graph:description>Room 104 door</graph:description>
		</graph:node>
		<graph:node>
			<graph:name>LEFTCORRIDOR_LIFT</graph:name>
			<graph:description>Room 104 door</graph:description>
		</graph:node>
		<graph:node>
			<graph:name>LEFTCORRIDOR_STAIR</graph:name>
			<graph:description>Room 104 door</graph:description>
		</graph:node>
		<graph:node>
			<graph:name>LEFTCORRIDOR_MIDDLE</graph:name>
			<graph:description>Room 104 door</graph:description>
		</graph:node>

		<graph:node>
			<graph:name>MIDDLE_WORKROOM_DOOR</graph:name>
			<graph:description>Room 104 door</graph:description>
		</graph:node>
		<graph:node>
			<graph:name>MIDDLE_WORKROOM_INNER1</graph:name>
			<graph:description>Room 104 door</graph:description>
		</graph:node>

		<graph:node>
			<graph:name>MIDDLE_STORAGEROOM_DOOR</graph:name>
			<graph:description>Room 104 door</graph:description>
		</graph:node>
		<graph:node>
			<graph:name>MIDDLE_STORAGEROOM_INNER1</graph:name>
			<graph:description>Room 104 door</graph:description>
		</graph:node>

		<graph:node>
			<graph:name>MIDDLE_CLEANINGROOM_DOOR</graph:name>
			<graph:description>Room 104 door</graph:description>
		</graph:node>

		<graph:node>
			<graph:name>WOMAN_WC_INNER1</graph:name>
			<graph:description>Room 104 door</graph:description>
		</graph:node>
		<graph:node>
			<graph:name>WOMAN_WC_INNER2</graph:name>
			<graph:description>Room 104 door</graph:description>
		</graph:node>
		<graph:node>
			<graph:name>WOMAN_WC_DOOR</graph:name>
			<graph:description>Room 104 door</graph:description>
		</graph:node>

		<graph:node>
			<graph:name>MIDDLE_DISABLEDROOM_DOOR</graph:name>
			<graph:description>Room 104 door</graph:description>
		</graph:node>

		<graph:node>
			<graph:name>ROOM105_DOOR</graph:name>
			<graph:description>Room 104 door</graph:description>
		</graph:node>
		<graph:node>
			<graph:name>ROOM105_INNER1</graph:name>
			<graph:description>Room 104 door</graph:description>
		</graph:node>

		<graph:node>
			<graph:name>MIDDLEBOTTOM_PRINTERROOM_DOOR</graph:name>
			<graph:description>Room 104 door</graph:description>
		</graph:node>
		<graph:node>
			<graph:name>MIDDLEBOTTOM_PRINTERROOM_INNER1</graph:name>
			<graph:description>Room 104 door</graph:description>
		</graph:node>

		<graph:node>
			<graph:name>MIDDLEBOTTOM_STORAGEROOM_DOOR</graph:name>
			<graph:description>Room 104 door</graph:description>
		</graph:node>
		<graph:node>
			<graph:name>MIDDLEBOTTOM_STORAGEROOM_INNER1</graph:name>
			<graph:description>Room 104 door</graph:description>
		</graph:node>

		<graph:node>
			<graph:name>MIDDLEBOTTOM_DINNERROOM_DOOR</graph:name>
			<graph:description>Room 104 door</graph:description>
		</graph:node>
		<graph:node>
			<graph:name>MIDDLEBOTTOM_DINNERROOM_INNER1</graph:name>
			<graph:description>Room 104 door</graph:description>
		</graph:node>

		<graph:node>
			<graph:name>MIDDLEBOTTOM_WC1_DOOR</graph:name>
			<graph:description>Room 104 door</graph:description>
		</graph:node>
		<graph:node>
			<graph:name>MIDDLEBOTTOM_WC2_DOOR</graph:name>
			<graph:description>Room 104 door</graph:description>
		</graph:node>

		<graph:node>
			<graph:name>MIDDLEBOTTOM_MANWC_DOOR</graph:name>
			<graph:description>Room 104 door</graph:description>
		</graph:node>
		<graph:node>
			<graph:name>MIDDLEBOTTOM_MANWC_INNER1</graph:name>
			<graph:description>Room 104 door</graph:description>
		</graph:node>
		<graph:node>
			<graph:name>MIDDLEBOTTOM_MANWC_INNER2</graph:name>
			<graph:description>Room 104 door</graph:description>
		</graph:node>

		<graph:node>
			<graph:name>ROOM106_DOOR</graph:name>
			<graph:description>Room 104 door</graph:description>
		</graph:node>
		<graph:node>
			<graph:name>ROOM106_INNER1</graph:name>
			<graph:description>Room 104 door</graph:description>
		</graph:node>

		<graph:node>
			<graph:name>RIGHTCORRIDOR_NODE1</graph:name>
			<graph:description>Room 104 door</graph:description>
		</graph:node>
		<graph:node>
			<graph:name>RIGHTCORRIDOR_NODE2</graph:name>
			<graph:description>Room 104 door</graph:description>
		</graph:node>
		<graph:node>
			<graph:name>RIGHTCORRIDOR_NODE3</graph:name>
			<graph:description>Room 104 door</graph:description>
		</graph:node>

		<graph:node>
			<graph:name>LIBRARY_DOOR</graph:name>
			<graph:description>Room 104 door</graph:description>
		</graph:node>
		<graph:node>
			<graph:name>LIBRARY_INNER1</graph:name>
			<graph:description>Room 104 door</graph:description>
		</graph:node>

		<graph:node>
			<graph:name>RECEPION_DOOR</graph:name>
			<graph:description>Room 104 door</graph:description>
		</graph:node>
		<graph:node>
			<graph:name>RECEPION_INNER1</graph:name>
			<graph:description>Room 104 door</graph:description>
		</graph:node>
		<graph:node>
			<graph:name>RECEPION_INNER2</graph:name>
			<graph:description>Room 104 door</graph:description>
		</graph:node>

		<graph:node>
			<graph:name>DEPARTMENTCENTER_DOOR</graph:name>
			<graph:description>Room 104 door</graph:description>
		</graph:node>
		<graph:node>
			<graph:name>DEPARTMENTCENTER_INNER1</graph:name>
			<graph:description>Room 104 door</graph:description>
		</graph:node>
		<graph:node>
			<graph:name>DEPARTMENTCENTER_INNER2</graph:name>
			<graph:description>Room 104 door</graph:description>
		</graph:node>

		<graph:node>
			<graph:name>TEACHERROOM1_DOOR</graph:name>
			<graph:description>Room 104 door</graph:description>
		</graph:node>
		<graph:node>
			<graph:name>TEACHERROOM1_INNER1</graph:name>
			<graph:description>Room 104 door</graph:description>
		</graph:node>
		<graph:node>
			<graph:name>TEACHERROOM1_INNER2</graph:name>
			<graph:description>Room 104 door</graph:description>
		</graph:node>

		<graph:node>
			<graph:name>TEACHERROOM2_DOOR</graph:name>
			<graph:description>Room 104 door</graph:description>
		</graph:node>
		<graph:node>
			<graph:name>TEACHERROOM2_INNER1</graph:name>
			<graph:description>Room 104 door</graph:description>
		</graph:node>
		<graph:node>
			<graph:name>TEACHERROOM2_INNER2</graph:name>
			<graph:description>Room 104 door</graph:description>
		</graph:node>

		<graph:node>
			<graph:name>TEACHERROOM3_DOOR</graph:name>
			<graph:description>Room 104 door</graph:description>
		</graph:node>
		<graph:node>
			<graph:name>TEACHERROOM3_INNER1</graph:name>
			<graph:description>Room 104 door</graph:description>
		</graph:node>
		<graph:node>
			<graph:name>TEACHERROOM3_INNER2</graph:name>
			<graph:description>Room 104 door</graph:description>
		</graph:node>

		<graph:node>
			<graph:name>TEACHERROOM4_DOOR</graph:name>